{
  "claim_id": "claim-f174dbb6f90f",
  "source_repository": "kimeisele/agent-world",
  "source_path": "docs/REPO_BOUNDARIES.md",
  "claim_text": "kimeisele/agent-world/docs/REPO_BOUNDARIES.md asserts agent-internet owns: routing, trust, city registration, wiki/search/crawling, bundle projection",
  "observed_at": "2026-10-09T06:35:12Z",
  "repository_pin": "pins/v0-boundary-drift/agent-world.json"
}
