{
  "claim_id": "claim-d0d79dcc6784",
  "source_repository": "kimeisele/agent-world",
  "source_path": "docs/REPO_BOUNDARIES.md",
  "claim_text": "kimeisele/agent-world/docs/REPO_BOUNDARIES.md asserts agent-city owns: mayor, council, economy, immigration, local campaigns, Pokedex",
  "observed_at": "2026-07-23T16:28:02Z",
  "repository_pin": "pin-agent-world-6771524abef2"
}
