{
  "claim_id": "claim-fac4b86aafd9",
  "source_repository": "kimeisele/agent-world",
  "source_path": "docs/REPO_BOUNDARIES.md",
  "claim_text": "kimeisele/agent-world/docs/REPO_BOUNDARIES.md (last audited: 2026-03-15) asserts agent-world role is \"World Governance\"",
  "observed_at": "2026-10-28T06:11:35Z",
  "repository_pin": "pins/v0-boundary-drift/agent-world.json"
}
