{
  "claim_id": "claim-4f60d2711ba0",
  "source_repository": "kimeisele/agent-world",
  "source_path": "docs/REPO_BOUNDARIES.md",
  "claim_text": "kimeisele/agent-world/docs/REPO_BOUNDARIES.md asserts steward-protocol owns: identity, capability types, Nadi protocol spec, federation descriptor schema",
  "observed_at": "2026-07-23T16:28:02Z",
  "repository_pin": "pin-agent-world-6771524abef2"
}
