{
  "claim_id": "claim-8544e99ff0e9",
  "source_repository": "kimeisele/agent-world",
  "source_path": "docs/REPO_BOUNDARIES.md",
  "claim_text": "kimeisele/agent-world/docs/REPO_BOUNDARIES.md asserts agent-template owns: federation node wizard, descriptor generation",
  "observed_at": "2026-07-23T16:28:02Z",
  "repository_pin": "pin-agent-world-6771524abef2"
}
