{
  "claim_id": "claim-5b3df48f922e",
  "source_repository": "kimeisele/steward-federation",
  "source_path": ".well-known/agent-federation.json",
  "claim_text": "kimeisele/steward-federation/.well-known/agent-federation.json asserts owner_boundary=\"federation_hub\" (kind=\"agent_federation_descriptor\")",
  "observed_at": "2026-07-23T16:28:02Z",
  "repository_pin": "pin-steward-federation-2ce22177d911"
}
