{
  "claim_id": "claim-344248b0587a",
  "source_repository": "kimeisele/agent-world",
  "source_path": "docs/REPO_BOUNDARIES.md",
  "claim_text": "kimeisele/agent-world/docs/REPO_BOUNDARIES.md (last audited: 2026-03-15) asserts agent-internet role is \"Control Plane + Projection\"",
  "observed_at": "2026-10-27T05:29:37Z",
  "repository_pin": "pins/v0-boundary-drift/agent-world.json"
}
