{
  "claim_id": "claim-82f2e7d21267",
  "source_repository": "kimeisele/agent-world",
  "source_path": "docs/REPO_BOUNDARIES.md",
  "claim_text": "kimeisele/agent-world/docs/REPO_BOUNDARIES.md asserts agent-research owns: research pipeline (4-phase), inquiry system",
  "observed_at": "2026-07-23T16:28:02Z",
  "repository_pin": "pin-agent-world-6771524abef2"
}
